"user_id","status_id","created_at","screen_name","text","source","display_text_width","reply_to_status_id","reply_to_user_id","reply_to_screen_name","is_quote","is_retweet","favorite_count","retweet_count","quote_count","reply_count","hashtags","symbols","urls_url","urls_t.co","urls_expanded_url","media_url","media_t.co","media_expanded_url","media_type","ext_media_url","ext_media_t.co","ext_media_expanded_url","ext_media_type","mentions_user_id","mentions_screen_name","lang","quoted_status_id","quoted_text","quoted_created_at","quoted_source","quoted_favorite_count","quoted_retweet_count","quoted_user_id","quoted_screen_name","quoted_name","quoted_followers_count","quoted_friends_count","quoted_statuses_count","quoted_location","quoted_description","quoted_verified","retweet_status_id","retweet_text","retweet_created_at","retweet_source","retweet_favorite_count","retweet_retweet_count","retweet_user_id","retweet_screen_name","retweet_name","retweet_followers_count","retweet_friends_count","retweet_statuses_count","retweet_location","retweet_description","retweet_verified","place_url","place_name","place_full_name","place_type","country","country_code","geo_coords","coords_coords","bbox_coords","status_url","name","location","description","url","protected","followers_count","friends_count","listed_count","statuses_count","favourites_count","account_created_at","verified","profile_url","profile_expanded_url","account_lang","profile_banner_url","profile_background_url","profile_image_url"
"x14260960","x1266467164036509707",2020-05-29 20:31:16,"JustinTrudeau","Since the Suez Crisis, Canadians have played a vital in role in dozens of peace operations.

On #PKDay, we pay tribute to the Canadians and 95,000 of our @UN partners serving in defence of peace around the world today. https://t.co/nqi6cNylzL","Twitter for iPhone",140,,,,FALSE,TRUE,0,32,,,"PKDay",,,,,,,,,,,,,"x493488747","L_MacAulay","en",,,,,,,,,,,,,,,,"x1266406282229166083","Since the Suez Crisis, Canadians have played a vital in role in dozens of peace operations.

On #PKDay, we pay tribute to the Canadians and 95,000 of our @UN partners serving in defence of peace around the world today. https://t.co/nqi6cNylzL",2020-05-29 16:29:21,"Twitter for iPhone",143,32,"x493488747","L_MacAulay","Lawrence MacAulay",13681,1301,7866,"","Member of Parliament for Cardigan, and Canada’s Minister of Veterans Affairs. // Député de Cardigan et ministre des Anciens Combattants du Canada.",TRUE,,,,,,,"NA NA","NA NA","NA NA NA NA NA NA NA NA","https://twitter.com/JustinTrudeau/status/1266467164036509707","Justin Trudeau","Papineau","Father, husband, 23rd Prime Minister of Canada. Account run by PM & staff. Papa, mari, 23e premier ministre du Canada. Compte géré par le PM et son personnel.","https://t.co/NJdKCDAm9d",FALSE,5039318,945,13421,29328,114,2008-03-30 21:04:14,TRUE,"https://t.co/NJdKCDAm9d","https://pm.gc.ca/",,"https://pbs.twimg.com/profile_banners/14260960/1585424352","http://abs.twimg.com/images/themes/theme1/bg.png","http://pbs.twimg.com/profile_images/1243986776672346113/jG94-jYz_normal.jpg"
"x14260960","x1266467151432613889",2020-05-29 20:31:13,"JustinTrudeau","Depuis la crise de Suez, les Canadiens ont joué un rôle vital dans des dizaines d'opérations de paix.

Le #PKDay, nous rendons hommage aux Canadiens et à 95 000 de nos partenaires @UN servant aujourd'hui à la défense de la paix dans le monde. https://t.co/KYEzDCfOnk","Twitter for iPhone",140,,,,FALSE,TRUE,0,12,,,"PKDay",,,,,,,,,,,,,"x493488747","L_MacAulay","fr",,,,,,,,,,,,,,,,"x1266406394296766464","Depuis la crise de Suez, les Canadiens ont joué un rôle vital dans des dizaines d'opérations de paix.

Le #PKDay, nous rendons hommage aux Canadiens et à 95 000 de nos partenaires @UN servant aujourd'hui à la défense de la paix dans le monde. https://t.co/KYEzDCfOnk",2020-05-29 16:29:47,"Twitter for iPhone",46,12,"x493488747","L_MacAulay","Lawrence MacAulay",13681,1301,7866,"","Member of Parliament for Cardigan, and Canada’s Minister of Veterans Affairs. // Député de Cardigan et ministre des Anciens Combattants du Canada.",TRUE,,,,,,,"NA NA","NA NA","NA NA NA NA NA NA NA NA","https://twitter.com/JustinTrudeau/status/1266467151432613889","Justin Trudeau","Papineau","Father, husband, 23rd Prime Minister of Canada. Account run by PM & staff. Papa, mari, 23e premier ministre du Canada. Compte géré par le PM et son personnel.","https://t.co/NJdKCDAm9d",FALSE,5039318,945,13421,29328,114,2008-03-30 21:04:14,TRUE,"https://t.co/NJdKCDAm9d","https://pm.gc.ca/",,"https://pbs.twimg.com/profile_banners/14260960/1585424352","http://abs.twimg.com/images/themes/theme1/bg.png","http://pbs.twimg.com/profile_images/1243986776672346113/jG94-jYz_normal.jpg"
"x14260960","x1266416139476893701",2020-05-29 17:08:31,"JustinTrudeau","For more information on the new supports we announced today and the steps we’re taking to help Indigenous people get through this pandemic, click the link below: https://t.co/c3wmTeA32E","Twitter for iPhone",185,"x1266416137916551173","x14260960","JustinTrudeau",FALSE,FALSE,276,45,,,,,"pm.gc.ca/en/news/news-r…","https://t.co/c3wmTeA32E","https://pm.gc.ca/en/news/news-releases/2020/05/29/prime-minister-announces-additional-funding-health-economic-and",,,,,,,,,,,"en",,,,,,,,,,,,,,,,,,,,,,,,,,,,,,,,,,,,,"NA NA","NA NA","NA NA NA NA NA NA NA NA","https://twitter.com/JustinTrudeau/status/1266416139476893701","Justin Trudeau","Papineau","Father, husband, 23rd Prime Minister of Canada. Account run by PM & staff. Papa, mari, 23e premier ministre du Canada. Compte géré par le PM et son personnel.","https://t.co/NJdKCDAm9d",FALSE,5039318,945,13421,29328,114,2008-03-30 21:04:14,TRUE,"https://t.co/NJdKCDAm9d","https://pm.gc.ca/",,"https://pbs.twimg.com/profile_banners/14260960/1585424352","http://abs.twimg.com/images/themes/theme1/bg.png","http://pbs.twimg.com/profile_images/1243986776672346113/jG94-jYz_normal.jpg"
"x14260960","x1266416137916551173",2020-05-29 17:08:30,"JustinTrudeau","Today, we’re announcing more support for Indigenous peoples and communities across the country that will:
✔️ improve access to public health and mental health resources
✔️ help families pay for groceries and make ends meet
✔️ fund new shelters for women and girls fleeing violence","Twitter for iPhone",280,,,,FALSE,FALSE,1893,292,,,,,,,,,,,,,,,,,,"en",,,,,,,,,,,,,,,,,,,,,,,,,,,,,,,,,,,,,"NA NA","NA NA","NA NA NA NA NA NA NA NA","https://twitter.com/JustinTrudeau/status/1266416137916551173","Justin Trudeau","Papineau","Father, husband, 23rd Prime Minister of Canada. Account run by PM & staff. Papa, mari, 23e premier ministre du Canada. Compte géré par le PM et son personnel.","https://t.co/NJdKCDAm9d",FALSE,5039318,945,13421,29328,114,2008-03-30 21:04:14,TRUE,"https://t.co/NJdKCDAm9d","https://pm.gc.ca/",,"https://pbs.twimg.com/profile_banners/14260960/1585424352","http://abs.twimg.com/images/themes/theme1/bg.png","http://pbs.twimg.com/profile_images/1243986776672346113/jG94-jYz_normal.jpg"
"x14260960","x1266416083801694215",2020-05-29 17:08:17,"JustinTrudeau","Pour obtenir plus de détails sur les fonds supplémentaires que nous avons annoncés aujourd’hui et l’aide que nous offrons aux peuples autochtones pour les aider à traverser cette pandémie, cliquez sur le lien ci-dessous : https://t.co/3kMmjq3Y9Z","Twitter for iPhone",245,"x1266416081704497152","x14260960","JustinTrudeau",FALSE,FALSE,69,13,,,,,"pm.gc.ca/fr/nouvelles/c…","https://t.co/3kMmjq3Y9Z","https://pm.gc.ca/fr/nouvelles/communiques/2020/05/29/premier-ministre-annonce-des-fonds-supplementaires-des-mesures-de",,,,,,,,,,,"fr",,,,,,,,,,,,,,,,,,,,,,,,,,,,,,,,,,,,,"NA NA","NA NA","NA NA NA NA NA NA NA NA","https://twitter.com/JustinTrudeau/status/1266416083801694215","Justin Trudeau","Papineau","Father, husband, 23rd Prime Minister of Canada. Account run by PM & staff. Papa, mari, 23e premier ministre du Canada. Compte géré par le PM et son personnel.","https://t.co/NJdKCDAm9d",FALSE,5039318,945,13421,29328,114,2008-03-30 21:04:14,TRUE,"https://t.co/NJdKCDAm9d","https://pm.gc.ca/",,"https://pbs.twimg.com/profile_banners/14260960/1585424352","http://abs.twimg.com/images/themes/theme1/bg.png","http://pbs.twimg.com/profile_images/1243986776672346113/jG94-jYz_normal.jpg"
"x14260960","x1266416081704497152",2020-05-29 17:08:17,"JustinTrudeau","On annonce du soutien pour les communautés autochtones pour :
✔️ améliorer l’accès à des ressources en santé publique et en santé mentale
✔️ aider les familles à payer leur épicerie et à joindre les deux bouts
✔️ financer de nouveaux refuges pour les femmes et les filles","Twitter for iPhone",271,,,,FALSE,FALSE,167,36,,,,,,,,,,,,,,,,,,"fr",,,,,,,,,,,,,,,,,,,,,,,,,,,,,,,,,,,,,"NA NA","NA NA","NA NA NA NA NA NA NA NA","https://twitter.com/JustinTrudeau/status/1266416081704497152","Justin Trudeau","Papineau","Father, husband, 23rd Prime Minister of Canada. Account run by PM & staff. Papa, mari, 23e premier ministre du Canada. Compte géré par le PM et son personnel.","https://t.co/NJdKCDAm9d",FALSE,5039318,945,13421,29328,114,2008-03-30 21:04:14,TRUE,"https://t.co/NJdKCDAm9d","https://pm.gc.ca/",,"https://pbs.twimg.com/profile_banners/14260960/1585424352","http://abs.twimg.com/images/themes/theme1/bg.png","http://pbs.twimg.com/profile_images/1243986776672346113/jG94-jYz_normal.jpg"
"x14260960","x1266376789707747333",2020-05-29 14:32:09,"JustinTrudeau","I’m giving an update on the steps we’re taking to keep you safe from COVID-19, and announcing new funding to help Indigenous families and communities during this crisis. Tune in now for the details: https://t.co/CswTQU28bh","Twitter for iPhone",222,,,,FALSE,FALSE,582,100,,,,,"cpac.ca/en/direct/cpac…","https://t.co/CswTQU28bh","https://www.cpac.ca/en/direct/cpac2/462469/pm-justin-trudeau-provides-update-on-federal-response-to-covid-19-43/",,,,,,,,,,,"en",,,,,,,,,,,,,,,,,,,,,,,,,,,,,,,,,,,,,"NA NA","NA NA","NA NA NA NA NA NA NA NA","https://twitter.com/JustinTrudeau/status/1266376789707747333","Justin Trudeau","Papineau","Father, husband, 23rd Prime Minister of Canada. Account run by PM & staff. Papa, mari, 23e premier ministre du Canada. Compte géré par le PM et son personnel.","https://t.co/NJdKCDAm9d",FALSE,5039318,945,13421,29328,114,2008-03-30 21:04:14,TRUE,"https://t.co/NJdKCDAm9d","https://pm.gc.ca/",,"https://pbs.twimg.com/profile_banners/14260960/1585424352","http://abs.twimg.com/images/themes/theme1/bg.png","http://pbs.twimg.com/profile_images/1243986776672346113/jG94-jYz_normal.jpg"
"x14260960","x1266376774323068935",2020-05-29 14:32:05,"JustinTrudeau","Comme à l’habitude, je fais le point sur les mesures qu’on prend pour vous protéger contre la COVID-19. J’annonce aussi de nouveaux fonds pour aider les familles et les communautés autochtones pendant la crise. Regardez maintenant : https://t.co/2WVTHby7gk","Twitter for iPhone",256,,,,FALSE,FALSE,165,35,,,,,"cpac.ca/fr/direct/cpac…","https://t.co/2WVTHby7gk","https://www.cpac.ca/fr/direct/cpac2/462480/le-pm-justin-trudeau-fait-le-point-sur-la-reponse-federale-a-la-covid-19-54/",,,,,,,,,,,"fr",,,,,,,,,,,,,,,,,,,,,,,,,,,,,,,,,,,,,"NA NA","NA NA","NA NA NA NA NA NA NA NA","https://twitter.com/JustinTrudeau/status/1266376774323068935","Justin Trudeau","Papineau","Father, husband, 23rd Prime Minister of Canada. Account run by PM & staff. Papa, mari, 23e premier ministre du Canada. Compte géré par le PM et son personnel.","https://t.co/NJdKCDAm9d",FALSE,5039318,945,13421,29328,114,2008-03-30 21:04:14,TRUE,"https://t.co/NJdKCDAm9d","https://pm.gc.ca/",,"https://pbs.twimg.com/profile_banners/14260960/1585424352","http://abs.twimg.com/images/themes/theme1/bg.png","http://pbs.twimg.com/profile_images/1243986776672346113/jG94-jYz_normal.jpg"
"x14260960","x1266366350995238914",2020-05-29 13:50:40,"JustinTrudeau","All property owners eligible for the Canada Emergency Commercial Rent Assistance for small businesses can apply today! More info on how to apply and eligibility: https://t.co/bn1Cd4rgCB https://t.co/JOtLQ4G3NC","Twitter for iPhone",140,,,,FALSE,TRUE,0,65,,,,,,,,,,,,,,,,"x14713787","CanadianPM","en",,,,,,,,,,,,,,,,"x1266346327442690049","All property owners eligible for the Canada Emergency Commercial Rent Assistance for small businesses can apply today! More info on how to apply and eligibility: https://t.co/bn1Cd4rgCB https://t.co/JOtLQ4G3NC",2020-05-29 12:31:06,"Twitter Web App",194,65,"x14713787","CanadianPM","CanadianPM",377359,942,6337,"Ottawa, Ontario, Canada","Official account of the Prime Minister of Canada – Terms: https://t.co/ANVrCFJcP1 – Français: @PMcanadien | For #COVID19 updates: @CPHO_Canada / @GovCanHealth",TRUE,,,,,,,"NA NA","NA NA","NA NA NA NA NA NA NA NA","https://twitter.com/JustinTrudeau/status/1266366350995238914","Justin Trudeau","Papineau","Father, husband, 23rd Prime Minister of Canada. Account run by PM & staff. Papa, mari, 23e premier ministre du Canada. Compte géré par le PM et son personnel.","https://t.co/NJdKCDAm9d",FALSE,5039318,945,13421,29328,114,2008-03-30 21:04:14,TRUE,"https://t.co/NJdKCDAm9d","https://pm.gc.ca/",,"https://pbs.twimg.com/profile_banners/14260960/1585424352","http://abs.twimg.com/images/themes/theme1/bg.png","http://pbs.twimg.com/profile_images/1243986776672346113/jG94-jYz_normal.jpg"
"x14260960","x1266366335371493379",2020-05-29 13:50:36,"JustinTrudeau","Tous les propriétaires d’immeubles éligibles à l’Aide d’urgence du Canada pour le loyer commercial destinée aux petites entreprises peuvent présenter une demande aujourd’hui! Détails: https://t.co/1sbrLxpOwY https://t.co/8ypFDBubmz","Twitter for iPhone",140,,,,FALSE,TRUE,0,24,,,,,,,,,,,,,,,,"x14713836","PMcanadien","fr",,,,,,,,,,,,,,,,"x1266346320299798530","Tous les propriétaires d’immeubles éligibles à l’Aide d’urgence du Canada pour le loyer commercial destinée aux petites entreprises peuvent présenter une demande aujourd’hui! Détails: https://t.co/1sbrLxpOwY https://t.co/8ypFDBubmz",2020-05-29 12:31:04,"Twitter Web App",82,24,"x14713836","PMcanadien","PMcanadien",25080,942,6314,"Ottawa (Ontario) Canada","Compte officiel du premier ministre du Canada – Conditions: https://t.co/Y5qMWvDOhl – English: @CanadianPM | Mises à jour #COVID19: @ACSP_Canada / @GouvCanSante",TRUE,,,,,,,"NA NA","NA NA","NA NA NA NA NA NA NA NA","https://twitter.com/JustinTrudeau/status/1266366335371493379","Justin Trudeau","Papineau","Father, husband, 23rd Prime Minister of Canada. Account run by PM & staff. Papa, mari, 23e premier ministre du Canada. Compte géré par le PM et son personnel.","https://t.co/NJdKCDAm9d",FALSE,5039318,945,13421,29328,114,2008-03-30 21:04:14,TRUE,"https://t.co/NJdKCDAm9d","https://pm.gc.ca/",,"https://pbs.twimg.com/profile_banners/14260960/1585424352","http://abs.twimg.com/images/themes/theme1/bg.png","http://pbs.twimg.com/profile_images/1243986776672346113/jG94-jYz_normal.jpg"
"x14260960","x1266354041950539777",2020-05-29 13:01:45,"JustinTrudeau","Every day, @UN peacekeepers lay the groundwork for true and lasting peace. They protect the most vulnerable, promote human rights, and are on the front lines in the fight against COVID-19. Today, we thank them for all they do and the sacrifices they make. https://t.co/vDVElzJTUt","Twitter for iPhone",279,,,,FALSE,FALSE,839,172,,,,,"pm.gc.ca/en/news/statem…","https://t.co/vDVElzJTUt","https://pm.gc.ca/en/news/statements/2020/05/29/statement-prime-minister-international-day-united-nations-peacekeepers",,,,,,,,,"x14159148","UN","en",,,,,,,,,,,,,,,,,,,,,,,,,,,,,,,,,,,,,"NA NA","NA NA","NA NA NA NA NA NA NA NA","https://twitter.com/JustinTrudeau/status/1266354041950539777","Justin Trudeau","Papineau","Father, husband, 23rd Prime Minister of Canada. Account run by PM & staff. Papa, mari, 23e premier ministre du Canada. Compte géré par le PM et son personnel.","https://t.co/NJdKCDAm9d",FALSE,5039318,945,13421,29328,114,2008-03-30 21:04:14,TRUE,"https://t.co/NJdKCDAm9d","https://pm.gc.ca/",,"https://pbs.twimg.com/profile_banners/14260960/1585424352","http://abs.twimg.com/images/themes/theme1/bg.png","http://pbs.twimg.com/profile_images/1243986776672346113/jG94-jYz_normal.jpg"
"x14260960","x1266353982273982466",2020-05-29 13:01:31,"JustinTrudeau","Les Casques bleus de l’@ONU_fr sont essentiels à une paix véritable et durable. Ils protègent les plus vulnérables et les droits de la personne et sont aux premières lignes de la lutte contre la COVID-19. Remercions-les pour tout ce qu’ils font. https://t.co/MSUKzMyQfX","Twitter for iPhone",269,,,,FALSE,FALSE,166,33,,,,,"pm.gc.ca/fr/nouvelles/d…","https://t.co/MSUKzMyQfX","https://pm.gc.ca/fr/nouvelles/declarations/2020/05/29/declaration-du-premier-ministre-loccasion-de-la-journee",,,,,,,,,"x259325103","ONU_fr","fr",,,,,,,,,,,,,,,,,,,,,,,,,,,,,,,,,,,,,"NA NA","NA NA","NA NA NA NA NA NA NA NA","https://twitter.com/JustinTrudeau/status/1266353982273982466","Justin Trudeau","Papineau","Father, husband, 23rd Prime Minister of Canada. Account run by PM & staff. Papa, mari, 23e premier ministre du Canada. Compte géré par le PM et son personnel.","https://t.co/NJdKCDAm9d",FALSE,5039318,945,13421,29328,114,2008-03-30 21:04:14,TRUE,"https://t.co/NJdKCDAm9d","https://pm.gc.ca/",,"https://pbs.twimg.com/profile_banners/14260960/1585424352","http://abs.twimg.com/images/themes/theme1/bg.png","http://pbs.twimg.com/profile_images/1243986776672346113/jG94-jYz_normal.jpg"
"x14260960","x1266203656371744768",2020-05-29 03:04:11,"JustinTrudeau","This evening, @cafreeland and I touched base with the premiers again. We talked about the need to take better care of the people who built our country, support jobs and businesses, and more. We’re focused on working together to help you and your family right now.","Twitter for iPhone",263,,,,FALSE,FALSE,3417,423,,,,,,,,,,,,,,,,"x203132018","cafreeland","en",,,,,,,,,,,,,,,,,,,,,,,,,,,,,,,,,,,,,"NA NA","NA NA","NA NA NA NA NA NA NA NA","https://twitter.com/JustinTrudeau/status/1266203656371744768","Justin Trudeau","Papineau","Father, husband, 23rd Prime Minister of Canada. Account run by PM & staff. Papa, mari, 23e premier ministre du Canada. Compte géré par le PM et son personnel.","https://t.co/NJdKCDAm9d",FALSE,5039318,945,13421,29328,114,2008-03-30 21:04:14,TRUE,"https://t.co/NJdKCDAm9d","https://pm.gc.ca/",,"https://pbs.twimg.com/profile_banners/14260960/1585424352","http://abs.twimg.com/images/themes/theme1/bg.png","http://pbs.twimg.com/profile_images/1243986776672346113/jG94-jYz_normal.jpg"
"x14260960","x1266203585492197376",2020-05-29 03:03:54,"JustinTrudeau","Ce soir, @cafreeland et moi avons discuté encore une fois avec les premiers ministres. On a notamment parlé de mieux prendre soin des aînés qui ont bâti notre pays ainsi que de la relance de notre économie. On est tous unis et on est là pour vous.","Twitter for iPhone",247,,,,FALSE,FALSE,364,42,,,,,,,,,,,,,,,,"x203132018","cafreeland","fr",,,,,,,,,,,,,,,,,,,,,,,,,,,,,,,,,,,,,"NA NA","NA NA","NA NA NA NA NA NA NA NA","https://twitter.com/JustinTrudeau/status/1266203585492197376","Justin Trudeau","Papineau","Father, husband, 23rd Prime Minister of Canada. Account run by PM & staff. Papa, mari, 23e premier ministre du Canada. Compte géré par le PM et son personnel.","https://t.co/NJdKCDAm9d",FALSE,5039318,945,13421,29328,114,2008-03-30 21:04:14,TRUE,"https://t.co/NJdKCDAm9d","https://pm.gc.ca/",,"https://pbs.twimg.com/profile_banners/14260960/1585424352","http://abs.twimg.com/images/themes/theme1/bg.png","http://pbs.twimg.com/profile_images/1243986776672346113/jG94-jYz_normal.jpg"
"x14260960","x1266196749116473344",2020-05-29 02:36:44,"JustinTrudeau","Canada is ready to do our part as we help bring the world together in the fight against #COVID19. Read PM Trudeau's remarks from today’s meeting with world leaders and international organizations: https://t.co/8ZVZbn6PA3 https://t.co/xOcrLSixzP","Twitter for iPhone",140,,,,FALSE,TRUE,0,342,,,"COVID19",,,,,,,,,,,,,"x14713787","CanadianPM","en",,,,,,,,,,,,,,,,"x1266139148856983553","Canada is ready to do our part as we help bring the world together in the fight against #COVID19. Read PM Trudeau's remarks from today’s meeting with world leaders and international organizations: https://t.co/8ZVZbn6PA3 https://t.co/xOcrLSixzP",2020-05-28 22:47:51,"Twitter Media Studio",1354,342,"x14713787","CanadianPM","CanadianPM",377359,942,6337,"Ottawa, Ontario, Canada","Official account of the Prime Minister of Canada – Terms: https://t.co/ANVrCFJcP1 – Français: @PMcanadien | For #COVID19 updates: @CPHO_Canada / @GovCanHealth",TRUE,,,,,,,"NA NA","NA NA","NA NA NA NA NA NA NA NA","https://twitter.com/JustinTrudeau/status/1266196749116473344","Justin Trudeau","Papineau","Father, husband, 23rd Prime Minister of Canada. Account run by PM & staff. Papa, mari, 23e premier ministre du Canada. Compte géré par le PM et son personnel.","https://t.co/NJdKCDAm9d",FALSE,5039318,945,13421,29328,114,2008-03-30 21:04:14,TRUE,"https://t.co/NJdKCDAm9d","https://pm.gc.ca/",,"https://pbs.twimg.com/profile_banners/14260960/1585424352","http://abs.twimg.com/images/themes/theme1/bg.png","http://pbs.twimg.com/profile_images/1243986776672346113/jG94-jYz_normal.jpg"
"x14260960","x1266196734927044608",2020-05-29 02:36:41,"JustinTrudeau","Le Canada est prêt à faire sa part pour amener le monde à lutter ensemble contre la #COVID19. Lisez l’allocution du PM Trudeau à la rencontre d’aujourd’hui avec des leaders mondiaux et des organisations internationales: https://t.co/RFnB4AgIGv https://t.co/YtGNWxm0Yo","Twitter for iPhone",140,,,,FALSE,TRUE,0,126,,,"COVID19",,,,,,,,,,,,,"x14713836","PMcanadien","fr",,,,,,,,,,,,,,,,"x1266139137951911937","Le Canada est prêt à faire sa part pour amener le monde à lutter ensemble contre la #COVID19. Lisez l’allocution du PM Trudeau à la rencontre d’aujourd’hui avec des leaders mondiaux et des organisations internationales: https://t.co/RFnB4AgIGv https://t.co/YtGNWxm0Yo",2020-05-28 22:47:48,"Twitter Media Studio",237,126,"x14713836","PMcanadien","PMcanadien",25080,942,6314,"Ottawa (Ontario) Canada","Compte officiel du premier ministre du Canada – Conditions: https://t.co/Y5qMWvDOhl – English: @CanadianPM | Mises à jour #COVID19: @ACSP_Canada / @GouvCanSante",TRUE,,,,,,,"NA NA","NA NA","NA NA NA NA NA NA NA NA","https://twitter.com/JustinTrudeau/status/1266196734927044608","Justin Trudeau","Papineau","Father, husband, 23rd Prime Minister of Canada. Account run by PM & staff. Papa, mari, 23e premier ministre du Canada. Compte géré par le PM et son personnel.","https://t.co/NJdKCDAm9d",FALSE,5039318,945,13421,29328,114,2008-03-30 21:04:14,TRUE,"https://t.co/NJdKCDAm9d","https://pm.gc.ca/",,"https://pbs.twimg.com/profile_banners/14260960/1585424352","http://abs.twimg.com/images/themes/theme1/bg.png","http://pbs.twimg.com/profile_images/1243986776672346113/jG94-jYz_normal.jpg"
"x14260960","x1266130259084292096",2020-05-28 22:12:31,"JustinTrudeau","We’re making sure Canadian families, who have been impacted by COVID-19, have the support they need. https://t.co/NSATRoBa7Y","Twitter for iPhone",140,,,,FALSE,TRUE,0,72,,,,,,,,,,,,,,,,"x2891740872","HonAhmedHussen","en",,,,,,,,,,,,,,,,"x1265995478912638976","We’re making sure Canadian families, who have been impacted by COVID-19, have the support they need. https://t.co/NSATRoBa7Y",2020-05-28 13:16:57,"Twitter Media Studio",279,72,"x2891740872","HonAhmedHussen","Ahmed Hussen",64246,667,10368,"Toronto, Ontario","Minister of Families, Children and Social Development / Ministre de la Famille, des Enfants et du Développmenet social | MP for York South-Weston. #YSW",TRUE,,,,,,,"NA NA","NA NA","NA NA NA NA NA NA NA NA","https://twitter.com/JustinTrudeau/status/1266130259084292096","Justin Trudeau","Papineau","Father, husband, 23rd Prime Minister of Canada. Account run by PM & staff. Papa, mari, 23e premier ministre du Canada. Compte géré par le PM et son personnel.","https://t.co/NJdKCDAm9d",FALSE,5039318,945,13421,29328,114,2008-03-30 21:04:14,TRUE,"https://t.co/NJdKCDAm9d","https://pm.gc.ca/",,"https://pbs.twimg.com/profile_banners/14260960/1585424352","http://abs.twimg.com/images/themes/theme1/bg.png","http://pbs.twimg.com/profile_images/1243986776672346113/jG94-jYz_normal.jpg"
"x14260960","x1266130250234200065",2020-05-28 22:12:29,"JustinTrudeau","Nous nous assurons que les familles canadiennes, qui ont été touchées par la pandémie de COVID-19, reçoivent le soutien dont elles ont besoin. https://t.co/XeCt56tF8Z","Twitter for iPhone",140,,,,FALSE,TRUE,0,29,,,,,,,,,,,,,,,,"x2891740872","HonAhmedHussen","fr",,,,,,,,,,,,,,,,"x1265995597745618945","Nous nous assurons que les familles canadiennes, qui ont été touchées par la pandémie de COVID-19, reçoivent le soutien dont elles ont besoin. https://t.co/XeCt56tF8Z",2020-05-28 13:17:26,"Twitter Media Studio",94,29,"x2891740872","HonAhmedHussen","Ahmed Hussen",64246,667,10368,"Toronto, Ontario","Minister of Families, Children and Social Development / Ministre de la Famille, des Enfants et du Développmenet social | MP for York South-Weston. #YSW",TRUE,,,,,,,"NA NA","NA NA","NA NA NA NA NA NA NA NA","https://twitter.com/JustinTrudeau/status/1266130250234200065","Justin Trudeau","Papineau","Father, husband, 23rd Prime Minister of Canada. Account run by PM & staff. Papa, mari, 23e premier ministre du Canada. Compte géré par le PM et son personnel.","https://t.co/NJdKCDAm9d",FALSE,5039318,945,13421,29328,114,2008-03-30 21:04:14,TRUE,"https://t.co/NJdKCDAm9d","https://pm.gc.ca/",,"https://pbs.twimg.com/profile_banners/14260960/1585424352","http://abs.twimg.com/images/themes/theme1/bg.png","http://pbs.twimg.com/profile_images/1243986776672346113/jG94-jYz_normal.jpg"
